{
  "schema_version": "finder-source-locations/1",
  "record_id": "workbook-row-2",
  "input": {
    "sheet": "问题线程堆栈",
    "row": 2,
    "occurrences": 212,
    "stack_sha256": "eb8367fe09ceb7b604c51bc33552269a419771a370a63e6bd01e488ffe74ef66",
    "raw_stack": "===================================================\ncause freeze thread:[AWT-EventQueue-0] RUNNABLE (in native)\ntopStack: 0 java.desktop@25.0.2/sun.awt.windows.WGlobalCursorManager.findHeavyweightUnderCursor(Native Method)\n1 java.desktop@25.0.2/sun.awt.GlobalCursorManager._updateCursor(GlobalCursorManager.java:178)\n2 java.desktop@25.0.2/sun.awt.GlobalCursorManager.updateCursorImmediately(GlobalCursorManager.java:95)\n3 java.desktop@25.0.2/sun.awt.windows.WComponentPeer.updateCursorImmediately(WComponentPeer.java:713)\n4 java.desktop@25.0.2/java.awt.Component.updateCursorImmediately(Component.java:3224)\n5 java.desktop@25.0.2/java.awt.Container.removeAll(Container.java:1344)\nproblemModuleStack: 6 com.intellij.openapi.actionSystem.impl.ActionToolbarImpl.actionsUpdated(ActionToolbarImpl.kt:1159)\n7 com.intellij.openapi.actionSystem.impl.ActionToolbarImpl$updateActionsImpl$job$1.invokeSuspend(ActionToolbarImpl.kt:1058)\n8 kotlin.coroutines.jvm.internal.BaseContinuationImpl.resumeWith(ContinuationImpl.kt:34)\n9 kotlinx.coroutines.UndispatchedCoroutine.afterResume(CoroutineContext.kt:277)\n10 kotlinx.coroutines.AbstractCoroutine.resumeWith(AbstractCoroutine.kt:101)\n11 kotlin.coroutines.jvm.internal.BaseContinuationImpl.resumeWith(ContinuationImpl.kt:47)\n12 kotlinx.coroutines.DispatchedTask.run(DispatchedTask.kt:100)\n13 com.intellij.openapi.application.impl.EdtCoroutineDispatcher$$Lambda/0x000000002eb6a778.run(Unknown Source)\n14 com.intellij.openapi.application.TransactionGuardImpl$2.run(TransactionGuardImpl.java:221)\n15 com.intellij.openapi.application.impl.NonBlockingFlushQueue.runNextEvent$lambda$1$1$0(NonBlockingFlushQueue.kt:334)\n16 com.intellij.openapi.application.impl.NonBlockingFlushQueue$$Lambda/0x000000002ec4c000.compute(Unknown Source)\n17 com.intellij.openapi.progress.impl.CoreProgressManager.computePrioritized(CoreProgressManager.java:928)\n18 com.intellij.openapi.application.impl.NonBlockingFlushQueue.runNextEvent$lambda$1$1(NonBlockingFlushQueue.kt:333)\n19 com.intellij.openapi.application.impl.NonBlockingFlushQueue$$Lambda/0x000000002ec47ce8.invoke(Unknown Source)\n20 com.intellij.concurrency.ThreadContext.resetThreadContext(threadContext.kt:294)\n21 com.intellij.openapi.application.impl.NonBlockingFlushQueue.runNextEvent$lambda$1(NonBlockingFlushQueue.kt:330)\n22 com.intellij.openapi.application.impl.NonBlockingFlushQueue$$Lambda/0x000000002ec475c0.invoke(Unknown Source)\n23 com.intellij.platform.locking.impl.NestedLocksThreadingSupport.tryRunWriteIntentReadAction(NestedLocksThreadingSupport.kt:747)\n24 com.intellij.openapi.application.impl.NonBlockingFlushQueue.runNextEvent(NonBlockingFlushQueue.kt:326)\n25 com.intellij.openapi.application.impl.NonBlockingFlushQueue.flushNow(NonBlockingFlushQueue.kt:305)\n26 com.intellij.openapi.application.impl.NonBlockingFlushQueue.FLUSH_NOW$lambda$0(NonBlockingFlushQueue.kt:167)\n27 com.intellij.openapi.application.impl.NonBlockingFlushQueue$$Lambda/0x000000002e1dca08.run(Unknown Source)\n28 java.desktop@25.0.2/java.awt.event.InvocationEvent.dispatch(InvocationEvent.java:323)\n29 java.desktop@25.0.2/java.awt.EventQueue.dispatchEventImpl(EventQueue.java:732)\n30 java.desktop@25.0.2/java.awt.EventQueue.dispatchEvent(EventQueue.java:711)\n31 com.intellij.ide.IdeEventQueue.defaultDispatchEvent(IdeEventQueue.kt:720)\n32 com.intellij.ide.IdeEventQueue._dispatchEvent(IdeEventQueue.kt:573)\n33 com.intellij.ide.IdeEventQueue.dispatchEvent$lambda$0$0$0(IdeEventQueue.kt:377)\n34 com.intellij.ide.IdeEventQueue$$Lambda/0x000000002eb5b800.invoke(Unknown Source)\n35 com.intellij.ide.IdeEventQueueKt.performActivity$lambda$0(IdeEventQueue.kt:1110)\n36 com.intellij.ide.IdeEventQueueKt$$Lambda/0x000000002eb5ba68.run(Unknown Source)\n37 com.intellij.openapi.application.TransactionGuardImpl.performActivity(TransactionGuardImpl.java:106)\n38 com.intellij.ide.IdeEventQueueKt.performActivity(IdeEventQueue.kt:1110)\n39 com.intellij.ide.IdeEventQueue.dispatchEvent$lambda$0(IdeEventQueue.kt:375)\n40 com.intellij.ide.IdeEventQueue$$Lambda/0x000000002eb5f420.run(Unknown Source)\n41 com.intellij.ide.IdeEventQueue.dispatchEvent(IdeEventQueue.kt:415)\n42 java.desktop@25.0.2/java.awt.EventDispatchThread.pumpOneEventForFilters(EventDispatchThread.java:207)\n43 java.desktop@25.0.2/java.awt.EventDispatchThread.pumpEventsForFilter(EventDispatchThread.java:128)\n44 java.desktop@25.0.2/java.awt.EventDispatchThread.pumpEventsForHierarchy(EventDispatchThread.java:117)\n45 java.desktop@25.0.2/java.awt.EventDispatchThread.pumpEvents(EventDispatchThread.java:113)\n46 java.desktop@25.0.2/java.awt.EventDispatchThread.pumpEvents(EventDispatchThread.java:105)\n47 java.desktop@25.0.2/java.awt.EventDispatchThread.run(EventDispatchThread.java:92)"
  },
  "parse": {
    "status": "PARSED",
    "diagnostics": [],
    "unparsed_lines": []
  },
  "threads": [
    {
      "name": "AWT-EventQueue-0",
      "state": "RUNNABLE",
      "details": "(in native)",
      "role": "cause",
      "is_ui_thread": true,
      "frames": [
        {
          "index": 0,
          "label": "topStack",
          "symbol": "java.desktop@25.0.2/sun.awt.windows.WGlobalCursorManager.findHeavyweightUnderCursor",
          "location": "Native Method",
          "file": null,
          "line": null,
          "elided": false,
          "raw": "topStack: 0 java.desktop@25.0.2/sun.awt.windows.WGlobalCursorManager.findHeavyweightUnderCursor(Native Method)",
          "frame_id": "t0:f0",
          "source": {
            "status": "UNRESOLVED",
            "reason": "SOURCE_FILE_NOT_FOUND",
            "candidates": [],
            "selected": null,
            "selection_basis": null,
            "source_diagnostics": [],
            "historical_identity": "NOT_CHECKED"
          }
        },
        {
          "index": 1,
          "label": null,
          "symbol": "java.desktop@25.0.2/sun.awt.GlobalCursorManager._updateCursor",
          "location": "GlobalCursorManager.java:178",
          "file": "GlobalCursorManager.java",
          "line": 178,
          "elided": false,
          "raw": "1 java.desktop@25.0.2/sun.awt.GlobalCursorManager._updateCursor(GlobalCursorManager.java:178)",
          "frame_id": "t0:f1",
          "source": {
            "status": "UNRESOLVED",
            "reason": "SOURCE_FILE_NOT_FOUND",
            "candidates": [],
            "selected": null,
            "selection_basis": null,
            "source_diagnostics": [],
            "historical_identity": "NOT_CHECKED"
          }
        },
        {
          "index": 2,
          "label": null,
          "symbol": "java.desktop@25.0.2/sun.awt.GlobalCursorManager.updateCursorImmediately",
          "location": "GlobalCursorManager.java:95",
          "file": "GlobalCursorManager.java",
          "line": 95,
          "elided": false,
          "raw": "2 java.desktop@25.0.2/sun.awt.GlobalCursorManager.updateCursorImmediately(GlobalCursorManager.java:95)",
          "frame_id": "t0:f2",
          "source": {
            "status": "UNRESOLVED",
            "reason": "SOURCE_FILE_NOT_FOUND",
            "candidates": [],
            "selected": null,
            "selection_basis": null,
            "source_diagnostics": [],
            "historical_identity": "NOT_CHECKED"
          }
        },
        {
          "index": 3,
          "label": null,
          "symbol": "java.desktop@25.0.2/sun.awt.windows.WComponentPeer.updateCursorImmediately",
          "location": "WComponentPeer.java:713",
          "file": "WComponentPeer.java",
          "line": 713,
          "elided": false,
          "raw": "3 java.desktop@25.0.2/sun.awt.windows.WComponentPeer.updateCursorImmediately(WComponentPeer.java:713)",
          "frame_id": "t0:f3",
          "source": {
            "status": "UNRESOLVED",
            "reason": "SOURCE_FILE_NOT_FOUND",
            "candidates": [],
            "selected": null,
            "selection_basis": null,
            "source_diagnostics": [],
            "historical_identity": "NOT_CHECKED"
          }
        },
        {
          "index": 4,
          "label": null,
          "symbol": "java.desktop@25.0.2/java.awt.Component.updateCursorImmediately",
          "location": "Component.java:3224",
          "file": "Component.java",
          "line": 3224,
          "elided": false,
          "raw": "4 java.desktop@25.0.2/java.awt.Component.updateCursorImmediately(Component.java:3224)",
          "frame_id": "t0:f4",
          "source": {
            "status": "UNRESOLVED",
            "reason": "METHOD_NOT_FOUND",
            "candidates": [],
            "selected": null,
            "selection_basis": null,
            "source_diagnostics": [],
            "historical_identity": "NOT_CHECKED"
          }
        },
        {
          "index": 5,
          "label": null,
          "symbol": "java.desktop@25.0.2/java.awt.Container.removeAll",
          "location": "Container.java:1344",
          "file": "Container.java",
          "line": 1344,
          "elided": false,
          "raw": "5 java.desktop@25.0.2/java.awt.Container.removeAll(Container.java:1344)",
          "frame_id": "t0:f5",
          "source": {
            "status": "UNRESOLVED",
            "reason": "METHOD_NOT_FOUND",
            "candidates": [],
            "selected": null,
            "selection_basis": null,
            "source_diagnostics": [],
            "historical_identity": "NOT_CHECKED"
          }
        },
        {
          "index": 6,
          "label": "problemModuleStack",
          "symbol": "com.intellij.openapi.actionSystem.impl.ActionToolbarImpl.actionsUpdated",
          "location": "ActionToolbarImpl.kt:1159",
          "file": "ActionToolbarImpl.kt",